<?xml version="1.0" encoding="UTF-8" standalone="no"?>
<!DOCTYPE QCM SYSTEM "QCM.dtd">
<QCM>
    <meta>
        <cours>DÃ©veloppement WEB</cours>
        <difficulte>Facile</difficulte>
    </meta>
    <question>
        <valeur>1</valeur>
        <enonce>a t'on besoin de faire ces choses ?</enonce>
        <reponse>
            <type>neutral</type>
            <content>non</content>
        </reponse>
        <reponse>
            <type>invalid</type>
            <content>ptet</content>
        </reponse>
        <reponse>
            <type>valid</type>
            <content>oui</content>
        </reponse>
    </question>
    <question>
        <valeur>2</valeur>
        <enonce>LA QUESTION DEEUX ?</enonce>
        <reponse>
            <type>neutral</type>
            <content>non</content>
        </reponse>
        <reponse>
            <type>invalid</type>
            <content> en rouge</content>
        </reponse>
        <reponse>
            <type>valid</type>
            <content> d'accord</content>
        </reponse>
    </question>
</QCM>